{
  "id": "crd_0198f4b2-7c3a-7d11-a5c6-6b6f39e34711",
  "schema_version": "approval-card/v1",
  "card_type": "decision",
  "source": {
    "harness": "k3",
    "session_ref": "session-01",
    "locator": "docs/handoff/decision-proposal.md"
  },
  "project_id": "prj_0198f4b2-7c3a-7d11-a5c6-6b6f39e34711",
  "scope": "project",
  "node_id": null,
  "title": "Approve progress log update cadence",
  "context": "The project needs a fixed cadence for progress updates.",
  "options": [
    {
      "id": "opt_daily",
      "label": "Daily",
      "description": "Update PROGRESS.md every working day.",
      "consequences": "Higher overhead, fresher status."
    },
    {
      "id": "opt_weekly",
      "label": "Weekly",
      "description": "Update PROGRESS.md once per week.",
      "consequences": "Lower overhead, less fresh status."
    }
  ],
  "recommendation": {
    "option_id": "opt_weekly",
    "rationale": "Weekly cadence balances overhead and freshness.",
    "confidence": 80
  },
  "if_rejected": "Keep the current ad hoc update pattern.",
  "class": "B",
  "impact": {
    "affected_paths": [
      "docs/PROGRESS.md"
    ],
    "effect_types": [
      "file.write"
    ]
  },
  "record_as_decision": false,
  "evidence": [
    "docs/PROGRESS.md"
  ],
  "routing": {
    "proposed_executor": "v4flash",
    "cost_tier": "low",
    "rationale": "Small documentation task."
  },
  "mode": "document",
  "extensions": {}
}
