{
  "id": "crd_0198f4b2-7c3a-7d12-a5c6-6b6f39e34712",
  "schema_version": "approval-card/v1",
  "card_type": "option_pick",
  "source": {
    "harness": "codex",
    "session_ref": "session-02",
    "locator": "docs/handoff/option-proposal.md"
  },
  "project_id": "prj_0198f4b2-7c3a-7d11-a5c6-6b6f39e34711",
  "scope": "project",
  "node_id": null,
  "title": "Choose storage library",
  "context": "Two candidate libraries are available for the file adapter.",
  "options": [
    {
      "id": "opt_lib_a",
      "label": "Library A",
      "description": "Minimal API with fewer features.",
      "consequences": "Less code, but limited extensibility."
    },
    {
      "id": "opt_lib_b",
      "label": "Library B",
      "description": "Feature rich and maintained.",
      "consequences": "More surface area and dependencies."
    }
  ],
  "recommendation": {
    "option_id": "opt_lib_a",
    "rationale": "The adapter only needs a small API.",
    "confidence": 65
  },
  "if_rejected": "Keep the current hand-rolled implementation.",
  "class": "B",
  "impact": {
    "affected_paths": [
      "plugins/project-control/src/filesync/"
    ],
    "effect_types": [
      "file.write"
    ]
  },
  "record_as_decision": false,
  "evidence": [
    "docs/design/library-comparison.md"
  ],
  "routing": {
    "proposed_executor": "v4flash",
    "cost_tier": "low",
    "rationale": "Implementation task in project-control plugin."
  },
  "mode": "code",
  "extensions": {}
}
